{
  "$schema": "../schema.json",
  "schemaVersion": 1,
  "name": "help-pty",
  "description": "top-level help through fixed-size TTY streams",
  "argv": ["--help"],
  "environment": {},
  "stdin": "",
  "workingDirectory": ".",
  "terminalMode": "pty",
  "timeoutMs": 10000,
  "mockHttp": {
    "captureHeaders": [],
    "exchanges": []
  },
  "filesystem": {
    "seed": []
  },
  "normalizations": []
}
