{
  "$schema": "../schema.json",
  "schemaVersion": 1,
  "name": "unknown-command",
  "description": "unknown command stderr and non-zero process status",
  "argv": ["parity-command-that-does-not-exist"],
  "environment": {},
  "stdin": "ignored input\n",
  "workingDirectory": ".",
  "terminalMode": "pipe",
  "timeoutMs": 10000,
  "mockHttp": {
    "captureHeaders": [],
    "exchanges": []
  },
  "filesystem": {
    "seed": []
  },
  "normalizations": []
}
